{
	"$schema": "../../schemas/cms-v2.schema.json",
	"id": "vtex",
	"chismografo": {
		"tipo": 2,
		"version": 1,
		"ultimaActualizacion": "2026-09-11",
		"revision": 0,
		"entorno": 0
	},
	"acercaDe": {
		"detallesGenerales": {
			"nombre": "VTEX",
			"web": "https://vtex.com",
			"logo": {
				"id": "vtex.com",
				"proveedor": "logodev"
			}
		},
		"precios": []
	},
	"herramienta": {
		"reglasDeteccion": [
			{
				"id": "vtex-meta-generator",
				"tipo": "meta",
				"llave": "generator",
				"patron": "vtex",
				"descripcion": "Meta generator contains \"VTEX\"",
				"peso": 1
			},
			{
				"id": "vtex-script-src-cdn",
				"tipo": "script-src",
				"patron": "vteximg\\.com\\.br|vtex-assets|vtex\\.com",
				"descripcion": "Scripts loaded from VTEX domains",
				"peso": 0.95
			},
			{
				"id": "vtex-link-href-cdn",
				"tipo": "link-href",
				"patron": "vteximg\\.com\\.br|vtex-assets|vtex\\.com",
				"descripcion": "Styles loaded from VTEX domains",
				"peso": 0.95
			},
			{
				"id": "vtex-header-server",
				"tipo": "header",
				"llave": "server",
				"patron": "vtex",
				"descripcion": "Server response header contains \"VTEX\"",
				"peso": 0.9
			},
			{
				"id": "vtex-header-powered-by",
				"tipo": "header",
				"llave": "x-powered-by",
				"patron": "vtex",
				"descripcion": "x-powered-by header contains \"VTEX\"",
				"peso": 0.9
			},
			{
				"id": "vtex-header-api",
				"tipo": "header",
				"llave": "x-vtex-api",
				"patron": ".*",
				"descripcion": "VTEX API response header present",
				"peso": 0.95
			},
			{
				"id": "vtex-js-object",
				"tipo": "script-content",
				"patron": "vtexjs|vtex-commerce-env|vtex\\.js",
				"descripcion": "VTEX JavaScript objects or environment variables",
				"peso": 0.95
			},
			{
				"id": "vtex-html-classes",
				"tipo": "html-class",
				"patron": "\\bvtex-",
				"descripcion": "HTML elements with VTEX components namespace classes",
				"peso": 0.9
			}
		]
	}
}
