{
	"$schema": "../../schemas/cms-v2.schema.json",
	"id": "woocommerce",
	"chismografo": {
		"tipo": 2,
		"version": 1,
		"ultimaActualizacion": "2026-09-11",
		"revision": 0,
		"entorno": 0
	},
	"acercaDe": {
		"detallesGenerales": {
			"nombre": "WooCommerce",
			"web": "https://woocommerce.com",
			"logo": {
				"id": "woocommerce.com",
				"proveedor": "logodev"
			}
		},
		"precios": []
	},
	"herramienta": {
		"reglasDeteccion": [
			{
				"id": "woocommerce-meta-generator",
				"tipo": "meta",
				"llave": "generator",
				"patron": "woocommerce",
				"descripcion": "Meta generator contains \"WooCommerce\"",
				"peso": 1
			},
			{
				"id": "woocommerce-script-src-plugin",
				"tipo": "script-src",
				"patron": "wp-content\\/plugins\\/woocommerce",
				"descripcion": "WooCommerce scripts loaded from plugins directory",
				"peso": 0.95
			},
			{
				"id": "woocommerce-link-href-plugin",
				"tipo": "link-href",
				"patron": "wp-content\\/plugins\\/woocommerce",
				"descripcion": "WooCommerce stylesheets loaded from plugins directory",
				"peso": 0.95
			},
			{
				"id": "woocommerce-body-class",
				"tipo": "html-class",
				"patron": "woocommerce|woocommerce-page|woocommerce-no-js",
				"descripcion": "WooCommerce CSS class found in body/html tags",
				"peso": 0.9
			},
			{
				"id": "woocommerce-js-params",
				"tipo": "script-content",
				"patron": "wc_add_to_cart_params|woocommerce_params",
				"descripcion": "WooCommerce parameter variables in page scripts",
				"peso": 0.95
			}
		]
	}
}
